{
  "case_id": "g057_t12_multi_tax_detail_with_subtotal",
  "category": "tax_rounding",
  "intent": "小計行ありの複数税率tax detailで合計を検算するケース",
  "receipt_kind": "receipt",
  "expected": {
    "store_name": "サンプル生成 テスト店",
    "store_address": "住所: サンプル県サンプル市生成町一丁目",
    "purchased_at": "2026-03-27T12:30:00+09:00",
    "currency": "JPY",
    "amount_basis": "tax_included",
    "tax_rate": null,
    "rounding": {
      "tax": "floor",
      "discount": "round",
      "scope": "per_tax_rate_group"
    },
    "items": [
      {
        "name": "サンプル品あ",
        "unit_price": 216,
        "quantity": 1,
        "line_total": 216,
        "tax_rate": 0.08,
        "discount_amount": 0
      },
      {
        "name": "サンプル品い",
        "unit_price": 330,
        "quantity": 1,
        "line_total": 330,
        "tax_rate": 0.1,
        "discount_amount": 0
      }
    ],
    "receipt_adjustments": [],
    "tax_details": [
      {
        "rate": 0.08,
        "net": 200,
        "tax": 16,
        "gross": 216,
        "basis": "gross",
        "label": "8%対象計"
      },
      {
        "rate": 0.1,
        "net": 300,
        "tax": 30,
        "gross": 330,
        "basis": "gross",
        "label": "10%対象計"
      }
    ],
    "subtotal": 500,
    "tax": 46,
    "total": 546,
    "payments": [
      {
        "method": "qr_payment",
        "label": "PayPay支払",
        "amount": 546
      }
    ],
    "payment_sum": 546,
    "payment_method": "qr_payment",
    "status": "completed",
    "review_reasons": []
  },
  "render": {
    "locale": "ja-JP",
    "paper_width": "80mm",
    "font": "system",
    "include_tax_detail_lines": true,
    "omit_subtotal_line": false,
    "include_payment_heading": false,
    "noise_lines": []
  },
  "degradation": {
    "enabled": false,
    "profile": null
  },
  "assertions": {
    "critical_exact": true,
    "allow_review_reasons": [],
    "allow_item_name_minor_diff": true
  }
}
