{
  "case_id": "g119_reference_decimal_gram",
  "category": "measurement",
  "intent": "A decimal-yen gram reference price remains exact candidate evidence without lossy unit-price persistence.",
  "receipt_kind": "receipt",
  "source": {
    "context": "analysis",
    "items": [
      {
        "item_index": 0,
        "printed_lines": ["サンプル粉末A 税込 ¥1.8/1g 850g", "¥1,530"],
        "purchased_quantity": "850",
        "purchased_unit": "gram",
        "reference_price_amount": "1.8",
        "reference_quantity": "1",
        "reference_unit": "gram",
        "reference_price_tax_inclusion": "gross",
        "printed_line_total": 1530
      }
    ]
  },
  "expected": {
    "store_name": "サンプル量売 小数価格店",
    "store_address": "サンプル県サンプル市基準町1-7",
    "purchased_at": "2026-08-07T10:00:00+09:00",
    "currency": "JPY",
    "amount_basis": "tax_included",
    "tax_rate": 0.1,
    "rounding": {"tax": "floor", "discount": "round", "scope": "per_tax_rate_group"},
    "items": [
      {
        "name": "サンプル粉末A",
        "unit_price": null,
        "quantity": "850",
        "quantity_unit_code": "gram",
        "pricing_source_kind": null,
        "reference_price_amount": null,
        "reference_quantity": null,
        "reference_quantity_unit_code": null,
        "reference_price_tax_inclusion": null,
        "original_line_total": 1530,
        "line_total": 1530,
        "tax_rate": 0.1,
        "discount_amount": 0
      }
    ],
    "measurement_projections": [
      {
        "item_index": 0,
        "exact_reference_amount": {"numerator": "1530", "denominator": "1"},
        "projected_reference_line_total": 1530,
        "discount_amount": 0,
        "discounted_source_line_total": 1530,
        "projected_gross_line_total": 1530
      }
    ],
    "reference_pricing_candidates": [
      {
        "item_index": 0,
        "validation_state": "valid",
        "rejection_reasons": [],
        "reference_price_amount": "1.8",
        "reference_quantity": "1",
        "reference_unit_code": "gram",
        "purchased_quantity": "850",
        "purchased_unit_code": "gram",
        "reference_price_tax_inclusion": "gross",
        "projected_line_total": 1530,
        "printed_line_total": "1530",
        "rounding_matches": ["floor", "half_up", "ceil"]
      }
    ],
    "receipt_adjustments": [],
    "tax_details": [{"rate": 0.1, "net": 1391, "tax": 139, "gross": 1530, "basis": "gross", "label": "10%対象計"}],
    "subtotal": 1391,
    "tax": 139,
    "total": 1530,
    "payments": [{"method": "cash", "label": "現金", "amount": 1530}],
    "payment_sum": 1530,
    "payment_method": "cash",
    "status": "completed",
    "review_reasons": []
  },
  "render": {"locale": "ja-JP", "paper_width": "58mm", "font": "monospace", "include_tax_detail_lines": true, "noise_lines": []},
  "degradation": {"enabled": false, "profile": null},
  "assertions": {"critical_exact": ["subtotal", "tax", "total", "payments", "tax_details", "item_amounts", "measurement_projections", "reference_pricing_candidates"], "allow_review_reasons": [], "allow_item_name_minor_diff": false}
}
