{
  "case_id": "g113_reference_per_100g",
  "category": "measurement",
  "intent": "A gross price per 100 grams keeps its exact source and projects once with HALF_UP.",
  "receipt_kind": "receipt",
  "source": {
    "context": "analysis",
    "items": [
      {
        "item_index": 0,
        "printed_lines": ["サンプル量売A 税込 ¥1,480/100g 342g", "¥5,062"],
        "purchased_quantity": "342",
        "purchased_unit": "gram",
        "reference_price_amount": "1480",
        "reference_quantity": "100",
        "reference_unit": "gram",
        "reference_price_tax_inclusion": "gross",
        "printed_line_total": 5062
      }
    ]
  },
  "expected": {
    "store_name": "サンプル量売 基準価格店",
    "store_address": "サンプル県サンプル市基準町1-1",
    "purchased_at": "2026-08-01T10:00:00+09:00",
    "currency": "JPY",
    "amount_basis": "tax_included",
    "tax_rate": 0.1,
    "rounding": {"tax": "floor", "discount": "round", "scope": "per_tax_rate_group"},
    "items": [
      {
        "name": "サンプル量売A",
        "unit_price": 1480,
        "quantity": "342",
        "quantity_unit_code": "gram",
        "pricing_source_kind": null,
        "reference_price_amount": null,
        "reference_quantity": null,
        "reference_quantity_unit_code": null,
        "reference_price_tax_inclusion": null,
        "original_line_total": 5062,
        "line_total": 5062,
        "tax_rate": 0.1,
        "discount_amount": 0
      }
    ],
    "measurement_projections": [
      {
        "item_index": 0,
        "exact_reference_amount": {"numerator": "25308", "denominator": "5"},
        "projected_reference_line_total": 5062,
        "discount_amount": 0,
        "discounted_source_line_total": 5062,
        "projected_gross_line_total": 5062
      }
    ],
    "reference_pricing_candidates": [
      {
        "item_index": 0,
        "validation_state": "valid",
        "rejection_reasons": [],
        "reference_price_amount": "1480",
        "reference_quantity": "100",
        "reference_unit_code": "gram",
        "purchased_quantity": "342",
        "purchased_unit_code": "gram",
        "reference_price_tax_inclusion": "gross",
        "projected_line_total": 5062,
        "printed_line_total": "5062",
        "rounding_matches": ["half_up", "ceil"]
      }
    ],
    "receipt_adjustments": [],
    "tax_details": [{"rate": 0.1, "net": 4602, "tax": 460, "gross": 5062, "basis": "gross", "label": "10%対象計"}],
    "subtotal": 4602,
    "tax": 460,
    "total": 5062,
    "payments": [{"method": "cash", "label": "現金", "amount": 5062}],
    "payment_sum": 5062,
    "payment_method": "cash",
    "status": "completed",
    "review_reasons": []
  },
  "render": {"locale": "ja-JP", "paper_width": "58mm", "font": "monospace", "include_tax_detail_lines": true, "noise_lines": []},
  "degradation": {"enabled": false, "profile": null},
  "assertions": {"critical_exact": ["subtotal", "tax", "total", "payments", "tax_details", "item_amounts", "measurement_projections", "reference_pricing_candidates"], "allow_review_reasons": [], "allow_item_name_minor_diff": false}
}
