{
  "case_id": "g170_calc_count_units_tax_twenty_seven",
  "category": "calculation_mode",
  "intent": "The remaining four count units including explicit quantity one at 27% gross tax. Fixed before render: required rates 1%,27%; LCG32 seed 20260830 draws 96%,75%,31%,60% from 1..99 except 1,8,10,27. Synthetic, not statutory rates.",
  "receipt_kind": "receipt",
  "source": {
    "context": "analysis",
    "count_tax_semantics": "reproducible_as_recorded",
    "items": [
      {
        "item_index": 0,
        "printed_lines": ["例示用紙 (税込27%)", "単価 @37円", "数量 5枚", "明細計 185円"],
        "purchased_quantity": "5",
        "purchased_unit": "sheet",
        "purchased_quantity_origin": "explicit",
        "count_unit_price_amount": "37",
        "printed_line_total": 185
      },
      {
        "item_index": 1,
        "printed_lines": ["例示照明 (税込27%)", "単価 @943円", "数量 1台", "明細計 943円"],
        "purchased_quantity": "1",
        "purchased_unit": "unit",
        "purchased_quantity_origin": "explicit",
        "count_unit_price_amount": "943",
        "printed_line_total": 943
      },
      {
        "item_index": 2,
        "printed_lines": ["例示収納品 (税込27%)", "単価 @419円", "数量 2箱", "明細計 838円"],
        "purchased_quantity": "2",
        "purchased_unit": "box",
        "purchased_quantity_origin": "explicit",
        "count_unit_price_amount": "419",
        "printed_line_total": 838
      },
      {
        "item_index": 3,
        "printed_lines": ["例示工作品 (税込27%)", "単価 @677円", "数量 3セット", "明細計 2031円"],
        "purchased_quantity": "3",
        "purchased_unit": "set",
        "purchased_quantity_origin": "explicit",
        "count_unit_price_amount": "677",
        "printed_line_total": 2031
      }
    ]
  },
  "expected": {
    "store_name": "架空計数検証店",
    "store_address": "架空県例示市検証町1-1",
    "purchased_at": "2026-08-01T09:00:00+09:00",
    "currency": "JPY",
    "amount_basis": "tax_included",
    "tax_rate": 0.27,
    "rounding": {"tax": "floor", "discount": "round", "scope": "per_tax_rate_group"},
    "items": [
      {
        "name": "例示用紙",
        "unit_price": 37,
        "quantity": "5",
        "quantity_unit_code": "sheet",
        "pricing_source_kind": "count_unit_price",
        "original_line_total": 185,
        "line_total": 185,
        "tax_rate": 0.27,
        "discount_amount": 0,
        "needs_review": false,
        "review_reasons": []
      },
      {
        "name": "例示照明",
        "unit_price": 943,
        "quantity": "1",
        "quantity_unit_code": "unit",
        "pricing_source_kind": "count_unit_price",
        "original_line_total": 943,
        "line_total": 943,
        "tax_rate": 0.27,
        "discount_amount": 0,
        "needs_review": false,
        "review_reasons": []
      },
      {
        "name": "例示収納品",
        "unit_price": 419,
        "quantity": "2",
        "quantity_unit_code": "box",
        "pricing_source_kind": "count_unit_price",
        "original_line_total": 838,
        "line_total": 838,
        "tax_rate": 0.27,
        "discount_amount": 0,
        "needs_review": false,
        "review_reasons": []
      },
      {
        "name": "例示工作品",
        "unit_price": 677,
        "quantity": "3",
        "quantity_unit_code": "set",
        "pricing_source_kind": "count_unit_price",
        "original_line_total": 2031,
        "line_total": 2031,
        "tax_rate": 0.27,
        "discount_amount": 0,
        "needs_review": false,
        "review_reasons": []
      }
    ],
    "receipt_adjustments": [],
    "tax_details": [{"rate": 0.27, "net": 3148, "tax": 849, "gross": 3997, "basis": "gross", "label": "27%対象計"}],
    "subtotal": 3148,
    "tax": 849,
    "total": 3997,
    "payments": [{"method": "cash", "label": "現金", "amount": 3997}],
    "payment_sum": 3997,
    "payment_method": "cash",
    "status": "completed",
    "review_reasons": []
  },
  "render": {"locale": "ja-JP", "paper_width": "58mm", "font": "monospace", "include_tax_detail_lines": true, "noise_lines": []},
  "degradation": {"enabled": false, "profile": null},
  "assertions": {"critical_exact": ["subtotal", "tax", "total", "payments", "tax_details", "item_amounts", "item_review_states"], "allow_review_reasons": [], "allow_item_name_minor_diff": false}
}
