{
  "case_id": "g181_calc_count_mixed_mild",
  "category": "calculation_mode",
  "intent": "Mixed-mode 80mm mild degradation Base g172_calc_count_reference_explicit_multi_tax; exact source, expected values and semantic meaning unchanged. Fixed before render: required rates 1%,27%; LCG32 seed 20260830 draws 96%,75%,31%,60% from 1..99 except 1,8,10,27. Synthetic, not statutory rates.",
  "receipt_kind": "receipt",
  "source": {
    "context": "analysis",
    "count_tax_semantics": "reproducible_as_recorded",
    "items": [
      {
        "item_index": 0,
        "printed_lines": ["例示個数品 (税込1%)", "単価 @193円", "数量 3本", "明細計 579円"],
        "purchased_quantity": "3",
        "purchased_unit": "piece",
        "purchased_quantity_origin": "explicit",
        "count_unit_price_amount": "193",
        "printed_line_total": 579
      },
      {
        "item_index": 1,
        "printed_lines": ["例示量売粉 (税込27%)", "税込 317円/100g", "計量 250g", "明細計 793円"],
        "purchased_quantity": "250",
        "purchased_unit": "gram",
        "purchased_quantity_origin": "explicit",
        "reference_price_amount": "317",
        "reference_quantity": "100",
        "reference_unit": "gram",
        "reference_price_tax_inclusion": "gross",
        "printed_line_total": 793
      },
      {
        "item_index": 2,
        "printed_lines": ["例示量売液 (税込75%)", "税込 126円/500ml", "計量 1.5L", "明細計 378円"],
        "purchased_quantity": "1.5",
        "purchased_unit": "liter",
        "purchased_quantity_origin": "explicit",
        "reference_price_amount": "126",
        "reference_quantity": "500",
        "reference_unit": "milliliter",
        "reference_price_tax_inclusion": "gross",
        "printed_line_total": 378
      },
      {
        "item_index": 3,
        "printed_lines": ["例示固定作業 (税込31%)", "明細計 503円"],
        "purchased_quantity": "1",
        "purchased_unit": "each",
        "purchased_quantity_origin": "fallback",
        "printed_line_total": 503
      }
    ]
  },
  "expected": {
    "store_name": "架空計数検証店",
    "store_address": "架空県例示市検証町1-1",
    "purchased_at": "2026-08-01T09:00:00+09:00",
    "currency": "JPY",
    "amount_basis": "tax_included",
    "tax_rate": null,
    "rounding": {"tax": "floor", "discount": "round", "scope": "per_tax_rate_group"},
    "items": [
      {
        "name": "例示個数品",
        "unit_price": 193,
        "quantity": "3",
        "quantity_unit_code": "piece",
        "pricing_source_kind": "count_unit_price",
        "original_line_total": 579,
        "line_total": 579,
        "tax_rate": 0.01,
        "discount_amount": 0,
        "needs_review": false,
        "review_reasons": []
      },
      {
        "name": "例示量売粉",
        "unit_price": null,
        "quantity": "250",
        "quantity_unit_code": "gram",
        "pricing_source_kind": "reference_quantity_price",
        "reference_price_amount": "317",
        "reference_quantity": "100",
        "reference_quantity_unit_code": "gram",
        "reference_price_tax_inclusion": "gross",
        "original_line_total": 793,
        "line_total": 793,
        "tax_rate": 0.27,
        "discount_amount": 0,
        "needs_review": false,
        "review_reasons": []
      },
      {
        "name": "例示量売液",
        "unit_price": null,
        "quantity": "1.5",
        "quantity_unit_code": "liter",
        "pricing_source_kind": "reference_quantity_price",
        "reference_price_amount": "126",
        "reference_quantity": "500",
        "reference_quantity_unit_code": "milliliter",
        "reference_price_tax_inclusion": "gross",
        "original_line_total": 378,
        "line_total": 378,
        "tax_rate": 0.75,
        "discount_amount": 0,
        "needs_review": false,
        "review_reasons": []
      },
      {
        "name": "例示固定作業",
        "unit_price": null,
        "quantity": "1",
        "quantity_unit_code": "each",
        "pricing_source_kind": "explicit_line_total",
        "original_line_total": 503,
        "line_total": 503,
        "tax_rate": 0.31,
        "discount_amount": 0,
        "needs_review": false,
        "review_reasons": []
      }
    ],
    "receipt_adjustments": [],
    "tax_details": [
      {"rate": 0.01, "net": 574, "tax": 5, "gross": 579, "basis": "gross", "label": "1%対象計"},
      {"rate": 0.27, "net": 625, "tax": 168, "gross": 793, "basis": "gross", "label": "27%対象計"},
      {"rate": 0.31, "net": 384, "tax": 119, "gross": 503, "basis": "gross", "label": "31%対象計"},
      {"rate": 0.75, "net": 216, "tax": 162, "gross": 378, "basis": "gross", "label": "75%対象計"}
    ],
    "subtotal": 1799,
    "tax": 454,
    "total": 2253,
    "payments": [{"method": "cash", "label": "現金", "amount": 2253}],
    "payment_sum": 2253,
    "payment_method": "cash",
    "status": "completed",
    "review_reasons": []
  },
  "render": {"locale": "ja-JP", "paper_width": "80mm", "font": "monospace", "include_tax_detail_lines": true, "noise_lines": []},
  "degradation": {"enabled": true, "profile": "mild"},
  "assertions": {"critical_exact": ["subtotal", "tax", "total", "payments", "tax_details", "item_amounts", "item_review_states"], "allow_review_reasons": [], "allow_item_name_minor_diff": false}
}
