{
  "case_id": "g012_normal_excluded_8_credit",
  "category": "normal",
  "intent": "Single 8% tax-excluded receipt paid by credit card.",
  "receipt_kind": "receipt",
  "expected": {
    "store_name": "サンプル外税 青葉テスト店",
    "store_address": "サンプル県サンプル市青葉12-2-2",
    "purchased_at": "2026-02-02T12:12:00+09:00",
    "currency": "JPY",
    "amount_basis": "tax_excluded",
    "tax_rate": 0.08,
    "rounding": { "tax": "floor", "discount": "round", "scope": "per_tax_rate_group" },
    "items": [
      { "name": "サンプル外税食品A", "unit_price": 900, "quantity": 1, "line_total": 900, "tax_rate": 0.08, "discount_amount": 0 },
      { "name": "サンプル外税食品B", "unit_price": 600, "quantity": 1, "line_total": 600, "tax_rate": 0.08, "discount_amount": 0 }
    ],
    "receipt_adjustments": [],
    "tax_details": [
      { "rate": 0.08, "net": 1500, "tax": 120, "gross": 1620, "basis": "net", "label": "8%対象額" }
    ],
    "subtotal": 1500,
    "tax": 120,
    "total": 1620,
    "payments": [
      { "method": "credit_card", "label": "クレジット", "amount": 1620 }
    ],
    "payment_sum": 1620,
    "payment_method": "credit_card",
    "status": "completed",
    "review_reasons": []
  },
  "render": { "locale": "ja-JP", "paper_width": "58mm", "font": "monospace", "include_tax_detail_lines": true, "noise_lines": [] },
  "degradation": { "enabled": false, "profile": null },
  "assertions": { "critical_exact": ["subtotal", "tax", "total", "payments", "tax_details"], "allow_review_reasons": [], "allow_item_name_minor_diff": false }
}
