{
  "case_id": "g171_calc_count_one_fallback_zero_missing",
  "category": "calculation_mode",
  "intent": "Explicit one is count; missing quantity is not count; explicit zero is not missing; missing item amount is not borrowed from the receipt summary. Fixed before render: required rates 1%,27%; LCG32 seed 20260830 draws 96%,75%,31%,60% from 1..99 except 1,8,10,27. Synthetic, not statutory rates.",
  "receipt_kind": "receipt",
  "source": {
    "context": "analysis",
    "count_tax_semantics": "reproducible_as_recorded",
    "items": [
      {
        "item_index": 0,
        "printed_lines": ["例示単品 (税込96%)", "単価 @257円", "数量 1個", "明細計 257円"],
        "purchased_quantity": "1",
        "purchased_unit": "each",
        "purchased_quantity_origin": "explicit",
        "count_unit_price_amount": "257",
        "printed_line_total": 257
      },
      {
        "item_index": 1,
        "printed_lines": ["例示固定料金 (税込96%)", "明細計 431円"],
        "purchased_quantity": "1",
        "purchased_unit": "each",
        "purchased_quantity_origin": "fallback",
        "printed_line_total": 431
      },
      {
        "item_index": 2,
        "printed_lines": ["例示無償品 (税込96%)", "明細計 0円"],
        "purchased_quantity": "1",
        "purchased_unit": "each",
        "purchased_quantity_origin": "fallback",
        "printed_line_total": 0
      },
      {
        "item_index": 3,
        "printed_lines": ["例示不完全品 (税込96%)", "数量 2個"],
        "purchased_quantity": "2",
        "purchased_unit": "each",
        "purchased_quantity_origin": "explicit"
      }
    ]
  },
  "expected": {
    "store_name": "架空計数検証店",
    "store_address": "架空県例示市検証町1-1",
    "purchased_at": "2026-08-01T09:00:00+09:00",
    "currency": "JPY",
    "amount_basis": "tax_included",
    "tax_rate": 0.96,
    "rounding": {"tax": "floor", "discount": "round", "scope": "per_tax_rate_group"},
    "items": [
      {
        "name": "例示単品",
        "unit_price": 257,
        "quantity": "1",
        "quantity_unit_code": "each",
        "pricing_source_kind": "count_unit_price",
        "original_line_total": 257,
        "line_total": 257,
        "tax_rate": 0.96,
        "discount_amount": 0,
        "needs_review": false,
        "review_reasons": []
      },
      {
        "name": "例示固定料金",
        "unit_price": null,
        "quantity": "1",
        "quantity_unit_code": "each",
        "pricing_source_kind": "explicit_line_total",
        "original_line_total": 431,
        "line_total": 431,
        "tax_rate": 0.96,
        "discount_amount": 0,
        "needs_review": false,
        "review_reasons": []
      },
      {
        "name": "例示無償品",
        "unit_price": null,
        "quantity": "1",
        "quantity_unit_code": "each",
        "pricing_source_kind": "explicit_line_total",
        "original_line_total": 0,
        "line_total": 0,
        "tax_rate": 0.96,
        "discount_amount": 0,
        "needs_review": false,
        "review_reasons": []
      },
      {
        "name": "例示不完全品",
        "unit_price": null,
        "quantity": "2",
        "quantity_unit_code": "each",
        "pricing_source_kind": null,
        "original_line_total": null,
        "line_total": null,
        "tax_rate": 0.96,
        "discount_amount": 0,
        "needs_review": true,
        "review_reasons": ["item_pricing_mode_uncertain"]
      }
    ],
    "receipt_adjustments": [],
    "tax_details": [{"rate": 0.96, "net": 352, "tax": 336, "gross": 688, "basis": "gross", "label": "96%対象計"}],
    "subtotal": 352,
    "tax": 336,
    "total": 688,
    "payments": [{"method": "cash", "label": "現金", "amount": 688}],
    "payment_sum": 688,
    "payment_method": "cash",
    "status": "review_needed",
    "review_reasons": ["item_pricing_mode_uncertain"]
  },
  "render": {"locale": "ja-JP", "paper_width": "58mm", "font": "monospace", "include_tax_detail_lines": true, "noise_lines": []},
  "degradation": {"enabled": false, "profile": null},
  "assertions": {"critical_exact": ["subtotal", "tax", "total", "payments", "tax_details", "item_amounts", "item_review_states"], "allow_review_reasons": ["item_pricing_mode_uncertain"], "allow_item_name_minor_diff": false}
}
