{
  "case_id": "g003_tax_multi_rate_gross",
  "category": "tax_rounding",
  "intent": "8% and 10% tax-included groups with printed gross tax details.",
  "receipt_kind": "receipt",
  "expected": {
    "store_name": "サンプルミックス 税率テスト店",
    "store_address": "サンプル県サンプル市税率3-3-3",
    "purchased_at": "2026-01-17T18:20:00+09:00",
    "currency": "JPY",
    "amount_basis": "tax_included",
    "tax_rate": null,
    "rounding": { "tax": "floor", "discount": "round", "scope": "per_tax_rate_group" },
    "items": [
      { "name": "サンプル食品A", "unit_price": 216, "quantity": 1, "line_total": 216, "tax_rate": 0.08, "discount_amount": 0 },
      { "name": "サンプル飲料A", "unit_price": 108, "quantity": 1, "line_total": 108, "tax_rate": 0.08, "discount_amount": 0 },
      { "name": "サンプル日用品A", "unit_price": 330, "quantity": 1, "line_total": 330, "tax_rate": 0.1, "discount_amount": 0 },
      { "name": "サンプル文具A", "unit_price": 110, "quantity": 1, "line_total": 110, "tax_rate": 0.1, "discount_amount": 0 }
    ],
    "receipt_adjustments": [],
    "tax_details": [
      { "rate": 0.08, "net": 300, "tax": 24, "gross": 324, "basis": "gross", "label": "8%対象計" },
      { "rate": 0.1, "net": 400, "tax": 40, "gross": 440, "basis": "gross", "label": "10%対象計" }
    ],
    "subtotal": 700,
    "tax": 64,
    "total": 764,
    "payments": [
      { "method": "e_money", "label": "交通系IC", "amount": 764 }
    ],
    "payment_sum": 764,
    "payment_method": "e_money",
    "status": "completed",
    "review_reasons": []
  },
  "render": { "locale": "ja-JP", "paper_width": "58mm", "font": "monospace", "include_tax_detail_lines": true, "noise_lines": [] },
  "degradation": { "enabled": false, "profile": null },
  "assertions": { "critical_exact": ["subtotal", "tax", "total", "payments", "tax_details"], "allow_review_reasons": [], "allow_item_name_minor_diff": false }
}
