{
  "case_id": "g038_d08_service_charge_excluded_10_qr",
  "category": "discount_adjustment",
  "intent": "サービス料を購入額への外税surchargeとして扱うケース",
  "receipt_kind": "receipt",
  "expected": {
    "store_name": "サンプル生成 テスト店",
    "store_address": "住所: サンプル県サンプル市生成町一丁目",
    "purchased_at": "2026-03-08T12:30:00+09:00",
    "currency": "JPY",
    "amount_basis": "tax_excluded",
    "tax_rate": 0.1,
    "rounding": {
      "tax": "floor",
      "discount": "round",
      "scope": "per_tax_rate_group"
    },
    "items": [
      {
        "name": "サンプル品あ",
        "unit_price": 1000,
        "quantity": 1,
        "line_total": 1000,
        "tax_rate": 0.1,
        "discount_amount": 0
      }
    ],
    "receipt_adjustments": [
      {
        "kind": "service_charge",
        "label": "サービス料",
        "sign": "surcharge",
        "amount": 300,
        "effect": "purchase",
        "tax_rate": 0.1,
        "tax_inclusion": "net"
      }
    ],
    "tax_details": [
      {
        "rate": 0.1,
        "net": 1300,
        "tax": 130,
        "gross": 1430,
        "basis": "net",
        "label": "10%対象額"
      }
    ],
    "subtotal": 1300,
    "tax": 130,
    "total": 1430,
    "payments": [
      {
        "method": "qr_payment",
        "label": "PayPay支払",
        "amount": 1430
      }
    ],
    "payment_sum": 1430,
    "payment_method": "qr_payment",
    "status": "completed",
    "review_reasons": []
  },
  "render": {
    "locale": "ja-JP",
    "paper_width": "80mm",
    "font": "system",
    "include_tax_detail_lines": true,
    "omit_subtotal_line": false,
    "include_payment_heading": false,
    "noise_lines": []
  },
  "degradation": {
    "enabled": false,
    "profile": null
  },
  "assertions": {
    "critical_exact": true,
    "allow_review_reasons": [],
    "allow_item_name_minor_diff": true
  }
}
