{
  "case_id": "g054_t09_net_10_odd_floor",
  "category": "tax_rounding",
  "intent": "10%外税で端数が出るnet税額floorケース",
  "receipt_kind": "receipt",
  "expected": {
    "store_name": "サンプル生成 テスト店",
    "store_address": "住所: サンプル県サンプル市生成町一丁目",
    "purchased_at": "2026-03-24T12:30:00+09:00",
    "currency": "JPY",
    "amount_basis": "tax_excluded",
    "tax_rate": 0.1,
    "rounding": {
      "tax": "floor",
      "discount": "round",
      "scope": "per_tax_rate_group"
    },
    "items": [
      {
        "name": "サンプル品あ",
        "unit_price": 999,
        "quantity": 1,
        "line_total": 999,
        "tax_rate": 0.1,
        "discount_amount": 0
      }
    ],
    "receipt_adjustments": [],
    "tax_details": [
      {
        "rate": 0.1,
        "net": 999,
        "tax": 99,
        "gross": 1098,
        "basis": "net",
        "label": "10%対象額"
      }
    ],
    "subtotal": 999,
    "tax": 99,
    "total": 1098,
    "payments": [
      {
        "method": "cash",
        "label": "現金",
        "amount": 1098
      }
    ],
    "payment_sum": 1098,
    "payment_method": "cash",
    "status": "completed",
    "review_reasons": []
  },
  "render": {
    "locale": "ja-JP",
    "paper_width": "80mm",
    "font": "system",
    "include_tax_detail_lines": true,
    "omit_subtotal_line": false,
    "include_payment_heading": false,
    "noise_lines": []
  },
  "degradation": {
    "enabled": false,
    "profile": null
  },
  "assertions": {
    "critical_exact": true,
    "allow_review_reasons": [],
    "allow_item_name_minor_diff": true
  }
}
